{
  "$schema": "http://json-schema.org/draft-07/schema#",
  "$id": "https://astrid.builtin-training/schemas/ai-toolkit-adapter-manifest.schema.json",
  "title": "AI-Toolkit Adapter Manifest",
  "description": "The flat 'clips' shape expected by builtin.training_run preflight and ai-toolkit staging. This is what the 'ai-toolkit-ltx' manifest adapter exports from the canonical manifest.",
  "type": "object",
  "required": ["clips"],
  "additionalProperties": false,
  "properties": {
    "clips": {
      "type": "array",
      "description": "Flat list of training clips with caption sidecars.",
      "minItems": 1,
      "items": {
        "type": "object",
        "required": ["clip_id", "clip_file"],
        "additionalProperties": false,
        "properties": {
          "clip_id": {
            "type": "string",
            "description": "Unique clip identifier. Derived from file stem if absent."
          },
          "clip_file": {
            "type": "string",
            "description": "Repo-root-relative path to the clip media file. Primary field for training preflight."
          },
          "path": {
            "type": "string",
            "description": "Alias for clip_file. Training preflight falls back to this if clip_file is absent."
          },
          "caption_file": {
            "type": "string",
            "description": "Repo-root-relative path to the sibling caption JSON sidecar: <clip_id>.caption.json."
          },
          "bucket": {
            "type": "string",
            "description": "Dataset bucket this clip belongs to."
          },
          "source_url": {
            "type": "string",
            "description": "Original source URL for provenance."
          },
          "duration_s": {
            "type": "number",
            "minimum": 0,
            "description": "Clip duration in seconds."
          },
          "content_hash": {
            "type": "string",
            "pattern": "^[a-f0-9]{64}$",
            "description": "SHA-256 content hash of the clip file."
          },
          "rights_status": {
            "type": "string",
            "enum": ["verified", "unknown", "needs_review", "restricted"]
          }
        }
      }
    },
    "vocabulary_path": {
      "type": "string",
      "description": "Optional path to the vocabulary YAML used for captioning."
    },
    "generated_at": {
      "type": "string",
      "format": "date-time",
      "description": "When this adapter manifest was generated."
    },
    "source_manifest": {
      "type": "string",
      "description": "Path to the canonical manifest this was derived from."
    }
  }
}
