{
  "clips": [
    {
      "clip_id": "fixture_vid-s01",
      "clip_file": "fixtures/media/test_clip_01.mp4",
      "path": "fixtures/media/test_clip_01.mp4",
      "caption_file": "fixtures/captions/fixture_vid-s01.caption.json",
      "bucket": "smoke_bucket",
      "source_url": "file://fixtures/media/test_clip_01.mp4",
      "duration_s": 5.0,
      "content_hash": "0000000000000000000000000000000000000000000000000000000000000001",
      "rights_status": "unknown"
    },
    {
      "clip_id": "fixture_vid-s03",
      "clip_file": "fixtures/media/test_clip_03.mp4",
      "path": "fixtures/media/test_clip_03.mp4",
      "caption_file": "fixtures/captions/fixture_vid-s03.caption.json",
      "bucket": "smoke_bucket",
      "source_url": "file://fixtures/media/test_clip_03.mp4",
      "duration_s": 7.5,
      "content_hash": "0000000000000000000000000000000000000000000000000000000000000003",
      "rights_status": "unknown"
    }
  ],
  "vocabulary_path": "fixtures/vocabulary.yaml",
  "generated_at": "2026-05-21T00:00:00Z",
  "source_manifest": "runs/fixture-smoke-test/manifest.json"
}
